{
  "schema_version": "govprov.scenario_manifest.v1",
  "scenario_id": "S2_configuration_change",
  "scenario_name": "Configuration Change",
  "workflow_id": "wf-S2-P2-F8-0001",
  "policy_version": "P2",
  "fault_id": "F8",
  "mode": "signed_offchain",
  "expected_verdict": "fail",
  "expected_failure_code": "separation_of_duties_violation",
  "expected_failure_stage": "approval",
  "expected_historical_compliance": "fail",
  "expected_current_compliance": "fail",
  "primary_actor_id": "agent.config_operator",
  "resource_id": "services/payment-api/config.yaml",
  "created_at": "2026-06-21T01:00:00Z"
}
